{
  "eventId": "evt_membershipchanged_001",
  "eventType": "MembershipChanged",
  "schemaVersion": 1,
  "occurredAt": "2026-08-10T02:00:00Z",
  "publishedAt": "2026-08-10T02:00:01Z",
  "producer": "SYS-08",
  "environment": "DEV",
  "audience": [
    "SYS-01",
    "SYS-05",
    "SYS-06"
  ],
  "enterpriseId": "ent_contract_001",
  "aggregateType": "Membership",
  "aggregateId": "mem_contract_001",
  "aggregateVersion": 2,
  "traceId": "trace_contract_fixture_001",
  "causationId": null,
  "correlationId": "corr_contract_fixture_001",
  "idempotencyKey": "MEMBERSHIP:mem_contract_001:2",
  "payload": {
    "membershipId": "mem_contract_001",
    "enterpriseId": "ent_contract_001",
    "planCode": "PRO",
    "planVersionId": "mpv_contract_001",
    "ruleVersion": 1,
    "status": "ACTIVE",
    "startsAt": "2026-08-10T02:00:00Z",
    "endsAt": "2027-08-10T02:00:00Z",
    "membershipVersion": 2,
    "changedAt": "2026-08-10T02:00:00Z"
  }
}
